[
  {
    "id": "harimau-sumatera",
    "name": "Harimau Sumatera",
    "latinName": "Panthera tigris sumatrae",
    "region": "sumatera",
    "province": [
      "RIAU",
      "SUMATERA BARAT",
      "ACEH",
      "LAMPUNG",
      "BENGKULU"
    ],
    "provinceMain": "RIAU",
    "type": "fauna",
    "status": "kritis",
    "statusEN": "CR",
    "population": "Kurang dari 400 ekor (2023)",
    "habitat": "Hutan hujan tropis dataran rendah hingga pegunungan",
    "threat": "Deforestasi akibat perluasan perkebunan sawit, perburuan liar untuk perdagangan kulit dan tulang, serta konflik dengan manusia.",
    "description": "Harimau Sumatera adalah satu-satunya subspesies harimau yang masih bertahan di Indonesia dan merupakan harimau terkecil di dunia. Dengan belang yang lebih rapat dibanding subspesies lain, harimau ini merupakan predator puncak yang menjaga keseimbangan ekosistem hutan Sumatera. Populasinya terus menurun drastis akibat hilangnya habitat dan perburuan liar yang tak terkendali.",
    "image": "/images/species/harimau-sumatera.jpg",
    "action": "Dukung program 'Harimau Kita' oleh WWF Indonesia dan laporkan aktivitas perburuan liar ke BKSDA setempat.",
    "funFact": "Harimau Sumatera adalah perenang ulung dan tidak menghindari air seperti kebanyakan kucing besar lainnya.",
    "source": "IUCN Red List 2023",
    "color": "#E74C3C"
  },
  {
    "id": "orangutan-sumatera",
    "name": "Orangutan Sumatera",
    "latinName": "Pongo abelii",
    "region": "sumatera",
    "province": [
      "ACEH",
      "SUMATERA UTARA"
    ],
    "provinceMain": "ACEH",
    "type": "fauna",
    "status": "kritis",
    "statusEN": "CR",
    "population": "Kurang dari 14.000 ekor (2020)",
    "habitat": "Hutan hujan tropis dataran rendah dan lahan gambut di Sumatera bagian utara",
    "threat": "Pembukaan lahan untuk perkebunan, pembalakan liar, kebakaran hutan, dan perburuan untuk dijadikan hewan peliharaan.",
    "description": "Orangutan Sumatera adalah primata terbesar di Asia dan salah satu kerabat terdekat manusia dengan kesamaan DNA mencapai 96,9%. Mereka dikenal sangat cerdas, mampu menggunakan alat, dan memiliki struktur sosial yang kompleks. Orangutan berperan penting dalam penyebaran benih tanaman sehingga menjadi 'arsitek hutan' yang tak tergantikan.",
    "image": "/images/species/orangutan-sumatera.jpg",
    "action": "Hindari produk yang mengandung minyak sawit tidak berkelanjutan dan dukung Sumatran Orangutan Society (SOS).",
    "funFact": "Orangutan menghabiskan hampir seluruh hidupnya di atas pohon dan membangun sarang baru dari ranting setiap malam.",
    "source": "IUCN Red List 2023",
    "color": "#E67E22"
  },
  {
    "id": "gajah-sumatera",
    "name": "Gajah Sumatera",
    "latinName": "Elephas maximus sumatranus",
    "region": "sumatera",
    "province": [
      "ACEH",
      "SUMATERA UTARA",
      "RIAU",
      "JAMBI",
      "SUMATERA SELATAN",
      "BENGKULU",
      "LAMPUNG"
    ],
    "provinceMain": "ACEH",
    "type": "fauna",
    "status": "kritis",
    "statusEN": "CR",
    "population": "2.400 - 2.800 individu (2022)",
    "habitat": "Hutan hujan dataran rendah, hutan sekunder, dan padang rumput di Sumatera",
    "threat": "Kehilangan habitat akibat deforestasi, perburuan gading ilegal, dan konflik satwa-manusia.",
    "description": "Gajah Sumatera adalah subspesies gajah Asia terkecil dengan telinga lebih besar dan ekor lebih panjang. Mereka memainkan peran krusial sebagai 'arsitek hutan' melalui penyebaran benih dan pembukaan jalan di hutan yang memungkinkan satwa lain bergerak. Gajah Sumatera hidup berkelompok matrilineal yang dipimpin oleh induk betina tertua.",
    "image": "/images/species/gajah-sumatera.jpg",
    "action": "Dukung Wildlife Conservation Society (WCS) Indonesia dan laporkan konflik gajah ke hotline KLHK.",
    "funFact": "Gajah Sumatera dapat menghasilkan suara infrasonik yang tidak terdengar manusia untuk berkomunikasi hingga jarak 10 km.",
    "source": "IUCN Red List 2023",
    "color": "#7F8C8D"
  },
  {
    "id": "badak-sumatera",
    "name": "Badak Sumatera",
    "latinName": "Dicerorhinus sumatrensis",
    "region": "sumatera",
    "province": [
      "ACEH",
      "SUMATERA BARAT"
    ],
    "provinceMain": "ACEH",
    "type": "fauna",
    "status": "kritis",
    "statusEN": "CR",
    "population": "Kurang dari 80 individu (2023)",
    "habitat": "Hutan hujan pegunungan dan lereng berbukit di Sumatera",
    "threat": "Perburuan tanduk untuk pengobatan tradisional Cina, hilangnya habitat, dan populasi yang terfragmentasi.",
    "description": "Badak Sumatera adalah badak terkecil di dunia dan satu-satunya badak berambut. Spesies ini sangat kuno secara evolusi, lebih dekat dengan badak yang hidup pada Era Es daripada badak lain yang masih ada. Badak Sumatera sangat pemalu dan soliter, hidup di hutan lebat yang sulit diakses, sehingga jarang terekam kamera.",
    "image": "/images/species/badak-sumatera.jpg",
    "action": "Dukung International Rhino Foundation (IRF) dan program perlindungan di Taman Nasional Way Kambas.",
    "funFact": "Badak Sumatera memiliki 'telinga berambut' yang unik — bulu telinga mereka membantu mengidentifikasi individu seperti sidik jari.",
    "source": "IUCN Red List 2023",
    "color": "#8B4513"
  },
  {
    "id": "siamang",
    "name": "Siamang",
    "latinName": "Symphalangus syndactylus",
    "region": "sumatera",
    "province": [
      "ACEH",
      "SUMATERA UTARA",
      "SUMATERA BARAT",
      "JAMBI",
      "SUMATERA SELATAN"
    ],
    "provinceMain": "SUMATERA BARAT",
    "type": "fauna",
    "status": "terancam",
    "statusEN": "EN",
    "population": "Diperkirakan menurun drastis",
    "habitat": "Hutan hujan tropis pegunungan Sumatera dan Semenanjung Malaya",
    "threat": "Deforestasi, perdagangan ilegal, dan konversi lahan untuk perkebunan.",
    "description": "Siamang adalah jenis gibbon terbesar dengan 'saka' atau selaput yang menghubungkan jari tengah dan manis. Mereka terkenal dengan nyanyian duet yang keras dan kompleks yang digunakan untuk menandai wilayah dan memperkuat ikatan pasangan. Siamang hidup dalam keluarga monogami yang stabil di kanopi hutan.",
    "image": "/images/species/siamang.jpg",
    "action": "Dukung konservasi hutan pegunungan Sumatera dan hindari perdagangan primata liar.",
    "funFact": "Saka (selaput tangan) pada Siamang memungkinkan mereka berayun hingga 15 meter antar pohon.",
    "source": "IUCN Red List 2023",
    "color": "#2C3E50"
  },
  {
    "id": "owa-berang-berang",
    "name": "Owa Berang-berang",
    "latinName": "Hylobates albibarbis",
    "region": "kalimantan",
    "province": [
      "KALIMANTAN SELATAN"
    ],
    "provinceMain": "KALIMANTAN SELATAN",
    "type": "fauna",
    "status": "terancam",
    "statusEN": "EN",
    "population": "Diperkirakan kurang dari 20.000 individu",
    "habitat": "Hutan hujan dataran rendah Kalimantan bagian selatan",
    "threat": "Deforestasi untuk perkebunan kelapa sawit dan perdagangan hewan peliharaan ilegal.",
    "description": "Owa Berang-berang atau Agile Gibbon adalah primata kecil yang sangat lincah. Jantan dewasa memiliki bulu hitam mengkilap dengan janggut putih khas yang memberinya nama 'albibarbis'. Mereka bergerak cepat di kanopi dengan gaya brachiation yang anggun dan hidup dalam kelompok kecil yang terdiri dari pasangan monogami dan anak-anak.",
    "image": "/images/species/owa-berang-beran.jpg",
    "action": "Dukung program konservasi hutan Kalimantan dan laporkan perdagangan owa liar.",
    "funFact": "Owa Berang-berang dapat melompat antar pohon sejauh 8 meter dalam sekali lompatan.",
    "source": "IUCN Red List 2023",
    "color": "#34495E"
  },
  {
    "id": "lutung-mentawai",
    "name": "Lutung Mentawai",
    "latinName": "Presbytis potenziani",
    "region": "sumatera",
    "province": [
      "SUMATERA BARAT"
    ],
    "provinceMain": "SUMATERA BARAT",
    "type": "fauna",
    "status": "terancam",
    "statusEN": "EN",
    "population": "Kurang dari 5.000 individu",
    "habitat": "Hutan hujan tropis Pulau Mentawai",
    "threat": "Deforestasi, perburuan untuk konsumsi daging, dan habitat terisolasi di kepulauan.",
    "description": "Lutung Mentawai adalah monyet endemik Kepulauan Mentawai dengan bulu berwarna coklat kemerahan yang unik. Spesies ini telah berevolusi secara terpisah selama ribuan tahun di pulau-pulau terisolasi. Lutung Mentawai hidup berkelompok dan sangat tergantung pada kanopi hutan untuk makanan dan perlindungan.",
    "image": "/images/species/lutung-mentawai.jpg",
    "action": "Dukung konservasi hutan Mentawai dan program ekowisata berkelanjutan di kepulauan.",
    "funFact": "Lutung Mentawai adalah satu dari empat spesies primata endemik Mentawai yang tidak ditemukan di tempat lain.",
    "source": "IUCN Red List 2023",
    "color": "#A0522D"
  },
  {
    "id": "beruang-madu",
    "name": "Beruang Madu",
    "latinName": "Helarctos malayanus",
    "region": "sumatera",
    "province": [
      "ACEH",
      "SUMATERA UTARA",
      "RIAU",
      "JAMBI",
      "SUMATERA SELATAN"
    ],
    "provinceMain": "RIAU",
    "type": "fauna",
    "status": "rentan",
    "statusEN": "VU",
    "population": "Tidak diketahui pasti, populasi menurun",
    "habitat": "Hutan hujan tropis dataran rendah dan pegunungan Sumatera dan Kalimantan",
    "threat": "Perburuan untuk bagian tubuh, perdagangan bayi, dan deforestasi.",
    "description": "Beruang Madu adalah beruang terkecil di dunia dengan panjang tubuh hanya 1,2-1,5 meter. Mereka memiliki lidah panjang yang sangat kuat untuk menjilat madu dan serangga dari sarang. Beruang ini juga dikenal sebagai 'beruang matahari' karena pola bulan sabit putih di dada mereka.",
    "image": "/images/species/beruang-madu.jpg",
    "action": "Dukung Bornean Sun Bear Conservation Centre dan hindari wisata yang mengeksploitasi beruang.",